ubuntu@siteA-gw:~$ sudo tcpdump -i eth0 -c 10 'udp port 500 or udp port 4500 or esp'
tcpdump: verbose output suppressed, use -v or -vv for full protocol decode
listening on eth0, link-type EN10MB (Ethernet), capture size 262144 bytes

20:55:01.123456 IP 10.10.99.10.500 > 10.10.99.20.500: isakmp: parent_sa ikev2_init[I]
20:55:01.125678 IP 10.10.99.20.500 > 10.10.99.10.500: isakmp: parent_sa ikev2_init[R]

20:55:05.445210 IP 10.10.99.10 > 10.10.99.20: ESP(spi=0x0a1b2c3d,seq=0x1), length 132
20:55:05.446522 IP 10.10.99.20 > 10.10.99.10: ESP(spi=0x4d3c2b1a,seq=0x1), length 132

10 packets captured
10 packets received by filter
0 packets dropped by kernel